{
  "schema": "build-recipe-1",
  "name": "vivec-arena-pit",
  "description": "MiniWind preset --miniwind-vivec-arena-pit: Vivec Arena Pit: combat test",
  "options": {
    "miniwind": true,
    "miniwind_scope": "full",
    "miniwind_description": "Vivec Arena Pit: combat test",
    "direct_to_game_map": "interior:Vivec, Arena Pit",
    "exclude": [
      "npc-gallery"
    ],
    "exclude_unreferenced": "voice,npcs"
  },
  "inputs": [],
  "written_with": null,
  "checked_with": null,
  "status": "unverified"
}
