{
  "schema": "build-recipe-1",
  "name": "balmora-exterior",
  "description": "MiniWind preset --miniwind-balmora-exterior: Balmora exterior (map only)",
  "options": {
    "miniwind": true,
    "miniwind_scope": "exterior",
    "miniwind_description": "Balmora exterior (map only)",
    "exclude_unreferenced": "voice,npcs"
  },
  "inputs": [],
  "written_with": null,
  "checked_with": null,
  "status": "unverified"
}
